{
  "$schema": "oebf://schema/0.1/junction",
  "id": "junction-core-floor-plan-clt-3-ff",
  "type": "Junction",
  "description": "CLT wall on grid line 3 at the first floor, mid-depth, plan",
  "elements": [
    "element-wall-clt-3-ff",
    "element-wall-clt-3-gf"
  ],
  "detail_id": "detail-nmb-core-floor-plan",
  "location": {
    "grid_id": "grid-secondary",
    "axes": [
      "3",
      "A-B"
    ],
    "level_id": "storey-ff",
    "level_offset_m": 0.0
  },
  "rule": "butt",
  "priority": [
    "element-wall-clt-3-ff"
  ],
  "trim_method": "none"
}
