{
  "$schema": "oebf://schema/0.1/junction",
  "id": "junction-pen-internal-section-3-ff",
  "type": "Junction",
  "description": "Services through the grid line 3 CLT wall and first floor, y = 1.5 m",
  "elements": [
    "element-wall-clt-3-ff",
    "element-wall-clt-3-gf"
  ],
  "detail_id": "detail-nmb-penetration-internal-slab-section",
  "location": {
    "grid_id": "grid-secondary",
    "axes": [
      "3",
      "A-M"
    ],
    "level_id": "storey-ff",
    "level_offset_m": 0.0
  },
  "rule": "butt",
  "priority": [
    "element-wall-clt-3-ff"
  ],
  "trim_method": "none"
}
