{
  "$schema": "oebf://schema/0.1/junction",
  "id": "junction-se-corner",
  "type": "Junction",
  "description": "SE corner: south wall butts into east wall (east wall runs through)",
  "elements": ["element-wall-south-gf", "element-wall-east-gf"],
  "detail_id": "detail-corner-cavity-butt",
  "location": { "grid_id": "grid-structural", "axes": ["2", "A"], "level_id": "storey-gf", "level_offset_m": 0.0 },
  "detail_overrides": { "cavity_closer_width_m": 0.075 },
  "rule": "butt",
  "priority": ["element-wall-east-gf"],
  "trim_planes": [{
    "element_id": "element-wall-south-gf",
    "at_end": "end",
    "plane_normal": { "x": -1, "y": 0, "z": 0 },
    "plane_origin": { "x": 5.4, "y": 0.0, "z": 0.0 }
  }]
}
