{
  "$schema": "oebf://schema/0.1/junction",
  "id": "junction-se-corner-ff",
  "type": "Junction",
  "description": "SE corner, first floor: south wall butts into east wall",
  "elements": [
    "element-wall-south-ff",
    "element-wall-east-ff"
  ],
  "detail_id": "detail-nmb-ew-column-plan",
  "location": {
    "grid_id": "grid-structural",
    "axes": [
      "4",
      "A"
    ],
    "level_id": "storey-ff",
    "level_offset_m": 0.0
  },
  "rule": "butt",
  "priority": [
    "element-wall-east-ff"
  ],
  "trim_method": "none"
}
