{
  "$schema": "oebf://schema/0.1/junction",
  "id": "junction-nw-corner-ff",
  "type": "Junction",
  "description": "NW corner, first floor: north wall butts into west wall",
  "elements": [
    "element-wall-north-ff",
    "element-wall-west-ff"
  ],
  "detail_id": "detail-nmb-ew-column-plan",
  "location": {
    "grid_id": "grid-structural",
    "axes": [
      "1",
      "B"
    ],
    "level_id": "storey-ff",
    "level_offset_m": 0.0
  },
  "rule": "butt",
  "priority": [
    "element-wall-west-ff"
  ],
  "trim_method": "none"
}
